codigo,descripcion,url
N39.4,Other specified urinary incontinence,https://www.niddk.nih.gov/health-information/urologic-diseases/bladder-control-problems/symptoms-causes
N39.8,Other specified disorders of urinary system,https://bio.libretexts.org/Bookshelves/Human_Biology/Book%3A_Human_Biology_(Wakim_and_Grewal)/19%3A_Urinary_System/19.5%3A_Disorders_of_the_Urinary_System
N39.9,"Disorder of urinary system, unspecified",https://www.healthgrades.com/right-care/kidneys-and-the-urinary-system/urinary-disorders
N40,Hyperplasia of prostate,https://www.niddk.nih.gov/health-information/urologic-diseases/prostate-problems/prostate-enlargement-benign-prostatic-hyperplasia
N41,Inflammatory diseases of prostate,https://www.niddk.nih.gov/health-information/urologic-diseases/prostate-problems/prostatitis-inflammation-prostate
N41.0,Acute prostatitis,https://www.niddk.nih.gov/health-information/urologic-diseases/prostate-problems/prostatitis-inflammation-prostate
N41.1,Chronic prostatitis,https://www.niddk.nih.gov/health-information/urologic-diseases/prostate-problems/prostatitis-inflammation-prostate
N41.2,Abscess of prostate,https://www.msdmanuals.com/home/men-s-health-issues/benign-prostate-disorders/prostate-abscess
N41.3,Prostatocystitis,https://www.mayoclinic.org/diseases-conditions/prostatitis/symptoms-causes/syc-20355766
N41.8,Other inflammatory diseases of prostate,https://www.mayoclinic.org/diseases-conditions/prostatitis/symptoms-causes/syc-20355766
N41.9,"Inflammatory disease of prostate, unspecified",https://www.mayoclinic.org/diseases-conditions/prostatitis/symptoms-causes/syc-20355766
N42,Other disorders of prostate,https://www.nia.nih.gov/health/prostate-problems
N42.0,Calculus of prostate,https://www.ncbi.nlm.nih.gov/pmc/articles/PMC5756803/
N42.1,Congestion and haemorrhage of prostate,https://www.mayoclinic.org/diseases-conditions/prostatitis/symptoms-causes/syc-20355766
N42.2,Atrophy of prostate,https://pubmed.ncbi.nlm.nih.gov/20815946/
N42.3,Dysplasia of prostate,https://www.mayoclinic.org/diseases-conditions/benign-prostatic-hyperplasia/symptoms-causes/syc-20370087
N42.8,Other specified disorders of prostate,https://www.nia.nih.gov/health/prostate-problems
N42.9,"Disorder of prostate, unspecified",https://www.mayoclinic.org/diseases-conditions/prostatitis/symptoms-causes/syc-20355766
N43,Hydrocele and spermatocele,https://www.healthline.com/health/mens-health/spermatocele
N43.0,Encysted hydrocele,https://www.cedars-sinai.org/health-library/diseases-and-conditions---pediatrics/h/hydrocele-in-children.html
N43.1,Infected hydrocele,https://www.mayoclinic.org/diseases-conditions/hydrocele/symptoms-causes/syc-20363969
N43.2,Other hydrocele,https://www.healthline.com/health/hydrocele
N43.3,"Hydrocele, unspecified",https://www.mayoclinic.org/diseases-conditions/hydrocele/symptoms-causes/syc-20363969
N43.4,Spermatocele,https://www.healthline.com/health/mens-health/spermatocele
N44,Torsion of testis,https://kidshealth.org/en/teens/torsion.html
N45,Orchitis and epididymitis,https://www.mayoclinic.org/diseases-conditions/epididymitis/symptoms-causes/syc-20363853
N45.0,"Orchitis, epididymitis and epididymo-orchitis with abscess",https://www.msdmanuals.com/home/men-s-health-issues/penile-and-testicular-disorders/epididymitis-and-epididymo-orchitis
N45.9,"Orchitis, epididymitis and epididymo-orchitis without abscess",https://patient.info/mens-health/scrotal-lumps-pain-and-swelling/epididymo-orchitis
N46,Male infertility,https://www.mayoclinic.org/es-es/diseases-conditions/male-infertility/symptoms-causes/syc-20374773
N47,"Redundant prepuce, phimosis and paraphimosis",https://www.urmc.rochester.edu/encyclopedia/content.aspx?ContentTypeID=90&ContentID=P03104
N48,Other disorders of penis,https://www.healthline.com/health/penis-diseases
N48.0,Leukoplakia of penis,https://cancer.ca/en/cancer-information/cancer-types/penile/what-is-penile-cancer/precancerous-conditions
N48.1,Balanoposthitis,https://my.clevelandclinic.org/health/diseases/21186-balanitis
N48.2,Other inflammatory disorders of penis,https://www.ncbi.nlm.nih.gov/pmc/articles/PMC5439293/
N48.3,Priapism,https://my.clevelandclinic.org/health/diseases/10042-priapism
N48.4,Impotence of organic origin,https://www.ncbi.nlm.nih.gov/books/NBK297/
N48.5,Ulcer of penis,https://www.healthline.com/health/health-penis-sores
N48.6,Induratio penis plastica,https://www.ncbi.nlm.nih.gov/medgen/10629
N48.8,Other specified disorders of penis,https://www.icd10data.com/ICD10CM/Codes/N00-N99/N40-N53/N48-/N48.89
N48.9,"Disorder of penis, unspecified",https://medlineplus.gov/penisdisorders.html
N49,"Inflammatory disorders of male genital organs, not elsewhere classified",https://icd.who.int/browse10/2019/en#/N49.8
N49.0,Inflammatory disorders of seminal vesicle,https://www.healthline.com/human-body-maps/seminal-vesicles
N49.1,"Inflammatory disorders of spermatic cord, tunica vaginalis and vas deferens",https://www.unboundmedicine.com/icd/view/ICD-10-CM/897010/all/N49_1___Inflammatory_disorders_of_spermatic_cord__tunica_vaginalis_and_vas_deferens
N49.2,Inflammatory disorders of scrotum,https://www.mayoclinic.org/diseases-conditions/epididymitis/symptoms-causes/syc-20363853
N49.8,Inflammatory disorders of other specified male genital organs,https://icd.who.int/browse10/2019/en#/N49.8
N49.9,Inflammatory disorder of unspecified male genital organ,https://www.icd10data.com/ICD10CM/Codes/N00-N99/N40-N53/N49-/N49.9
N50,Other disorders of male genital organs,https://www.theurologyfoundation.org/urologyhealth/male-reproductive-organs
N50.0,Atrophy of testis,https://www.healthline.com/health/testicular-atrophy
N50.1,Vascular disorders of male genital organs,http://www.malacards.org/card/male_genital_organ_vascular_disease
N50.8,Other specified disorders of male genital organs,https://www.icd10data.com/ICD10CM/Codes/N00-N99/N40-N53/N50-/N50.8
N50.9,"Disorder of male genital organs, unspecified",https://www.icd10data.com/ICD10CM/Codes/N00-N99/N40-N53/N50-/N50.9
N51,Disorders of male genital organs in diseases classified elsewhere,https://icd.who.int/browse10/2016/en#/N51.1
N51.0,Disorders of prostate in diseases classified elsewhere,https://icd.who.int/browse10/2010/en#/N40-N51
N51.1,Disorders of testis and epididymis in diseases classified elsewhere,https://icd.who.int/browse10/2019/en#/N49.8
N51.2,Balanitis in diseases classified elsewhere,https://www.icd10data.com/ICD10CM/Codes/N00-N99/N40-N53/N48-/N48.1
N51.8,Other disorders of male genital organs in diseases classified elsewhere,https://icd.who.int/browse10/2016/en#/N51.1
N60,Benign mammary dysplasia,https://www.cancer.gov/publications/dictionaries/cancer-terms/def/mammary-dysplasia
N60.0,Solitary cyst of breast,https://www.mayoclinic.org/diseases-conditions/breast-cysts/symptoms-causes/syc-20370284
N60.1,Diffuse cystic mastopathy,https://www.mountsinai.org/health-library/diseases-conditions/fibrocystic-breast-disease
N60.2,Fibroadenosis of breast,https://www.mayoclinic.org/diseases-conditions/fibrocystic-breasts/symptoms-causes/syc-20350438
N60.3,Fibrosclerosis of breast,https://www.mayoclinic.org/diseases-conditions/fibrocystic-breasts/symptoms-causes/syc-20350438
N60.4,Mammary duct ectasia,https://my.clevelandclinic.org/health/diseases/17949-mammary-duct-ectasia
N60.8,Other benign mammary dysplasias,https://www.cancer.gov/publications/dictionaries/cancer-terms/def/mammary-dysplasia
N60.9,"Benign mammary dysplasia, unspecified",https://www.cancer.gov/publications/dictionaries/cancer-terms/def/mammary-dysplasia
N61,Inflammatory disorders of breast,https://www.cancer.org/cancer/breast-cancer/about/types-of-breast-cancer/inflammatory-breast-cancer.html
N62,Hypertrophy of breast,https://www.healthline.com/health/gigantomastia
N63,Unspecified lump in breast,https://www.mayoclinic.org/diseases-conditions/suspicious-breast-lumps/symptoms-causes/syc-20352786
N64,Other disorders of breast,https://www.childrenshospital.org/conditions-and-treatments/conditions/b/breast-disorders
N64.0,Fissure and fistula of nipple,https://www.healthline.com/health/nipple-fissure
N64.1,Fat necrosis of breast,https://breastcancernow.org/information-support/have-i-got-breast-cancer/breast-lumps-other-benign-conditions/fat-necrosis
N64.2,Atrophy of breast,https://www.healthline.com/health/aging-changes-in-the-breast
N64.3,Galactorrhoea not associated with childbirth,https://www.mayoclinic.org/diseases-conditions/galactorrhea/symptoms-causes/syc-20350431
N64.4,Mastodynia,https://www.breastcancer.org/symptoms/benign/mastalgia
N64.5,Other signs and symptoms in breast,https://www.cdc.gov/cancer/breast/basic_info/symptoms.htm
N64.8,Other specified disorders of breast,https://my.clevelandclinic.org/health/articles/6270-benign-breast-disease
N64.9,"Disorder of breast, unspecified",https://www.icd10data.com/ICD10CM/Codes/N00-N99/N60-N65/N64-/N64.9
N70,Salpingitis and oophoritis,https://www.betterhealth.vic.gov.au/health/conditionsandtreatments/salpingitis
N70.0,Acute salpingitis and oophoritis,https://www.betterhealth.vic.gov.au/health/conditionsandtreatments/salpingitis
N70.1,Chronic salpingitis and oophoritis,https://www.betterhealth.vic.gov.au/health/conditionsandtreatments/salpingitis
N70.9,"Salpingitis and oophoritis, unspecified",https://www.healthline.com/health/womens-health/salpingitis
N71,"Inflammatory disease of uterus, except cervix",https://www.mayoclinic.org/diseases-conditions/pelvic-inflammatory-disease/symptoms-causes/syc-20352594
N71.0,Acute inflammatory disease of uterus,https://www.cdc.gov/std/pid/stdfact-pid.htm
N71.1,Chronic inflammatory disease of uterus,https://www.cdc.gov/std/pid/stdfact-pid.htm
N71.9,"Inflammatory disease of uterus, unspecified",https://www.mayoclinic.org/diseases-conditions/pelvic-inflammatory-disease/symptoms-causes/syc-20352594
N72,Inflammatory disease of cervix uteri,https://www.mayoclinic.org/diseases-conditions/cervicitis/symptoms-causes/syc-20370814
N73,Other female pelvic inflammatory diseases,https://www.cdc.gov/std/pid/stdfact-pid.htm
N73.0,Acute parametritis and pelvic cellulitis,http://medbox.iiab.me/kiwix/wikipedia_en_medicine_2019-12/A/Parametritis
N73.1,Chronic parametritis and pelvic cellulitis,http://medbox.iiab.me/kiwix/wikipedia_en_medicine_2019-12/A/Parametritis
N73.2,Unspecified parametritis and pelvic cellulitis,https://www.icd10data.com/ICD10CM/Codes/N00-N99/N70-N77/N73-/N73.0
N73.3,Female acute pelvic peritonitis,https://www.mayoclinic.org/diseases-conditions/peritonitis/symptoms-causes/syc-20376247
N73.4,Female chronic pelvic peritonitis,https://www.mayoclinic.org/diseases-conditions/peritonitis/symptoms-causes/syc-20376247
N73.5,"Female pelvic peritonitis, unspecified",https://www.mayoclinic.org/diseases-conditions/pelvic-inflammatory-disease/symptoms-causes/syc-20352594
N73.6,Female pelvic peritoneal adhesions,https://www.betterhealth.vic.gov.au/health/conditionsandtreatments/adhesions
N73.8,Other specified female pelvic inflammatory diseases,https://www.cdc.gov/std/pid/stdfact-pid.htm
N73.9,"Female pelvic inflammatory disease, unspecified",https://www.cdc.gov/std/pid/stdfact-pid.htm
N74,Female pelvic inflammatory disorders in diseases classified elsewhere,https://icd.who.int/browse10/2019/en#/N73.3
N74.0,Tuberculous infection of cervix uteri,https://www.ncbi.nlm.nih.gov/pmc/articles/PMC4921606/
N74.1,Female tuberculous pelvic inflammatory disease,https://www.ncbi.nlm.nih.gov/pmc/articles/PMC5663156/
N74.2,Female syphilitic pelvic inflammatory disease,https://www.cdc.gov/std/pid/stdfact-pid.htm
N74.3,Female gonococcal pelvic inflammatory disease,https://my.clevelandclinic.org/health/diseases/9129-pelvic-inflammatory-disease-pid
N74.4,Female chlamydial pelvic inflammatory disease,https://www.cdc.gov/std/pid/stdfact-pid.htm
N74.8,Female pelvic inflammatory disorders in other diseases classified elsewhere,https://www.icd10data.com/ICD10CM/Codes/N00-N99/N70-N77/N74-/N74
N75,Diseases of Bartholin gland,https://my.clevelandclinic.org/health/diseases/17737-bartholin-cyst
N75.0,Cyst of Bartholin gland,https://my.clevelandclinic.org/health/diseases/17737-bartholin-cyst
N75.1,Abscess of Bartholin gland,https://www.healthline.com/health/bartholins-abscess
N75.8,Other diseases of Bartholin gland,https://my.clevelandclinic.org/health/diseases/17737-bartholin-cyst
N75.9,"Disease of Bartholin gland, unspecified",https://my.clevelandclinic.org/health/diseases/17737-bartholin-cyst
N76,Other inflammation of vagina and vulva,https://www.healthline.com/health/womens-health/swollen-vulva
N76.0,Acute vaginitis,https://www.mayoclinic.org/diseases-conditions/vaginitis/symptoms-causes/syc-20354707
N76.1,Subacute and chronic vaginitis,https://www.mayoclinic.org/diseases-conditions/vaginitis/symptoms-causes/syc-20354707
N76.2,Acute vulvitis,https://www.hopkinsmedicine.org/health/conditions-and-diseases/vulvitis
N76.3,Subacute and chronic vulvitis,https://www.hopkinsmedicine.org/health/conditions-and-diseases/vulvitis
N76.4,Abscess of vulva,https://www.medicalnewstoday.com/articles/322390
N76.5,Ulceration of vagina,https://www.healthline.com/health/womens-health/ulcers-vulva
N76.6,Ulceration of vulva,https://www.healthline.com/health/womens-health/ulcers-vulva
N76.8,Other specified inflammation of vagina and vulva,https://www.medicalnewstoday.com/articles/175101
N77,Vulvovaginal ulceration and inflammation in diseases classified elsewhere,https://icd.who.int/browse10/2019/en#/N77.1
N77.0,Ulceration of vulva in infectious and parasitic diseases classified elsewhere,https://www.icd10data.com/ICD10CM/Codes/N00-N99/N70-N77/N77-/N77.0
N77.1,"Vaginitis, vulvitis and vulvovaginitis in infectious and parasitic diseases classified elsewhere",https://www.icd10data.com/ICD10CM/Codes/N00-N99/N70-N77/N77-/N77.1
N77.8,Vulvovaginal ulceration and inflammation in other diseases classified elsewhere,https://icd.who.int/browse10/2019/en#/N77.1
N80,Endometriosis,https://www.hopkinsmedicine.org/health/conditions-and-diseases/endometriosis
N80.0,Endometriosis of uterus,https://www.hopkinsmedicine.org/health/conditions-and-diseases/endometriosis
N80.1,Endometriosis of ovary,https://www.hopkinsmedicine.org/health/conditions-and-diseases/endometriosis
N80.2,Endometriosis of fallopian tube,https://www.webmd.com/women/endometriosis/endometriosis-and-fallopian-tube-problems
N80.3,Endometriosis of pelvic peritoneum,https://www.hopkinsmedicine.org/health/conditions-and-diseases/endometriosis
N80.4,Endometriosis of rectovaginal septum and vagina,https://www.medicalnewstoday.com/articles/323993
N80.5,Endometriosis of intestine,https://www.webmd.com/women/endometriosis/bowel-endometriosis
N80.6,Endometriosis in cutaneous scar,https://www.ncbi.nlm.nih.gov/pmc/articles/PMC5849346/
N80.8,Other endometriosis,https://www.hopkinsmedicine.org/health/conditions-and-diseases/endometriosis
N80.9,"Endometriosis, unspecified",https://www.mayoclinic.org/diseases-conditions/endometriosis/symptoms-causes/syc-20354656
N81,Female genital prolapse,https://my.clevelandclinic.org/health/diseases/17597-vaginal-prolapse
N81.0,Female urethrocele,https://www.healthline.com/health/urethral-prolapse
N81.1,Cystocele,https://www.niddk.nih.gov/health-information/urologic-diseases/cystocele
N81.2,Incomplete uterovaginal prolapse,https://www.mayoclinic.org/diseases-conditions/uterine-prolapse/symptoms-causes/syc-20353458
N81.3,Complete uterovaginal prolapse,https://www.nhs.uk/conditions/pelvic-organ-prolapse/
N81.4,"Uterovaginal prolapse, unspecified",https://www.mayoclinic.org/diseases-conditions/uterine-prolapse/symptoms-causes/syc-20353458
N81.5,Vaginal enterocele,https://my.clevelandclinic.org/health/diseases/16966-enterocele
N81.6,Rectocele,https://www.hopkinsmedicine.org/health/conditions-and-diseases/rectocele
N81.8,Other female genital prolapse,https://my.clevelandclinic.org/health/diseases/17597-vaginal-prolapse
N81.9,"Female genital prolapse, unspecified",https://my.clevelandclinic.org/health/diseases/17597-vaginal-prolapse
N82,Fistulae involving female genital tract,https://my.clevelandclinic.org/health/diseases/22079-vaginal-fistula
N82.0,Vesicovaginal fistula,https://www.webmd.com/women/guide/what-is-a-vaginal-fistula
N82.1,Other female urinary-genital tract fistulae,https://my.clevelandclinic.org/health/diseases/22079-vaginal-fistula
N82.2,Fistula of vagina to small intestine,https://my.clevelandclinic.org/health/diseases/22079-vaginal-fistula
N82.3,Fistula of vagina to large intestine,https://my.clevelandclinic.org/health/diseases/22079-vaginal-fistula
N82.4,Other female intestinal-genital tract fistulae,https://my.clevelandclinic.org/health/diseases/22079-vaginal-fistula
N82.5,Female genital tract-skin fistulae,https://my.clevelandclinic.org/health/diseases/22079-vaginal-fistula
N82.8,Other female genital tract fistulae,https://my.clevelandclinic.org/health/diseases/22079-vaginal-fistula
N82.9,"Female genital tract fistula, unspecified",https://my.clevelandclinic.org/health/diseases/22079-vaginal-fistula
N83,"Noninflammatory disorders of ovary, fallopian tube and broad ligament",https://www.lvhn.org/conditions/noninflammatory-disorders-ovary-fallopian-tube-and-broad-ligament/doctors
N83.0,Follicular cyst of ovary,https://www.nhs.uk/conditions/ovarian-cyst/
N83.1,Corpus luteum cyst,https://www.samvankirk.com/blog/all-about-corpus-luteum-cysts
N83.2,Other and unspecified ovarian cysts,https://www.nhs.uk/conditions/ovarian-cyst/
N83.3,Acquired atrophy of ovary and fallopian tube,https://www.mypathologyreport.ca/ovary-atrophy/
N83.4,Prolapse and hernia of ovary and fallopian tube,https://pubmed.ncbi.nlm.nih.gov/28681369/
N83.5,"Torsion of ovary, ovarian pedicle and fallopian tube",https://www.yalemedicine.org/conditions/ovarian-torsion
N83.6,Haematosalpinx,https://fertilitypedia.org/edu/diagnoses/hematosalpinx
N83.7,Haematoma of broad ligament,https://link.springer.com/chapter/10.1007/978-981-10-4953-8_41
N83.8,"Other noninflammatory disorders of ovary, fallopian tube and broad ligament",https://www.lvhn.org/conditions/noninflammatory-disorders-ovary-fallopian-tube-and-broad-ligament/doctors
N83.9,"Noninflammatory disorder of ovary, fallopian tube and broad ligament, unspecified",http://cdek.wustl.edu/icd10/N83/
N84,Polyp of female genital tract,https://www.mayoclinic.org/diseases-conditions/uterine-polyps/symptoms-causes/syc-20378709
N84.0,Polyp of corpus uteri,https://my.clevelandclinic.org/health/diseases/14683-uterine-polyps
N84.1,Polyp of cervix uteri,https://www.healthnavigator.org.nz/health-a-z/c/cervical-polyps/
N84.2,Polyp of vagina,https://www.healthnavigator.org.nz/health-a-z/c/cervical-polyps/
N84.3,Polyp of vulva,https://www.medicalnewstoday.com/articles/322437
N84.8,Polyp of other parts of female genital tract,https://www.webmd.com/women/guide/cervical-polyps
N84.9,"Polyp of female genital tract, unspecified",https://www.mayoclinic.org/diseases-conditions/uterine-polyps/symptoms-causes/syc-20378709
N85,"Other noninflammatory disorders of uterus, except cervix",http://cdek.wustl.edu/icd10/N85/
N85.0,Endometrial glandular hyperplasia,https://my.clevelandclinic.org/health/diseases/16569-atypical-endometrial-hyperplasia
N85.1,Endometrial adenomatous hyperplasia,https://familydoctor.org/condition/endometrial-hyperplasia/
N85.2,Hypertrophy of uterus,https://my.clevelandclinic.org/health/diseases/16569-atypical-endometrial-hyperplasia
N85.3,Subinvolution of uterus,https://en.wikipedia.org/wiki/Subinvolution
N85.4,Malposition of uterus,https://emedicine.medscape.com/article/272497-overview
N85.5,Inversion of uterus,https://en.wikipedia.org/wiki/Uterine_inversion
N85.6,Intrauterine synechiae,https://www.ingenes.com/international/are-you-a-candidate/female-infertility-causes/uterine-synechiae/
N85.7,Haematometra,https://medcraveonline.com/OGIJ/hematometra-and-hematocolpos-secondary-to-cervical-canal-occlusion-a-case-report-and-review-of-literature.html
N85.8,Other specified noninflammatory disorders of uterus,https://icd.who.int/browse10/2019/en#/N80-N98
N85.9,"Noninflammatory disorder of uterus, unspecified",https://www.centralbiohub.com/patient-samples/digestive-genitourinary-disorders-samples/noninflammatory-disorders-of-female-genital-tract/
N86,Erosion and ectropion of cervix uteri,https://www.medicinenet.com/what_causes_cervical_ectropion/article.htm
N87,Dysplasia of cervix uteri,https://www.webmd.com/cancer/cervical-cancer/cervical-dysplasia-symptoms-causes-treatments
N87.0,Mild cervical dysplasia,https://www.webmd.com/cancer/cervical-cancer/cervical-dysplasia-symptoms-causes-treatments
N87.1,Moderate cervical dysplasia,https://www.webmd.com/cancer/cervical-cancer/cervical-dysplasia-symptoms-causes-treatments
N87.2,"Severe cervical dysplasia, not elsewhere classified",https://my.clevelandclinic.org/health/diseases/15678-cervical-intraepithelial-neoplasia-cin
N87.9,"Dysplasia of cervix uteri, unspecified",https://www.healthline.com/health/cervical-dysplasia
N88,Other noninflammatory disorders of cervix uteri,https://medlineplus.gov/cervixdisorders.html
N88.0,Leukoplakia of cervix uteri,https://screening.iarc.fr/atlascolpodetail.php?Index=38&e=
N88.1,Old laceration of cervix uteri,https://www.jstor.org/stable/25258264
N88.2,Stricture and stenosis of cervix uteri,https://www.draliabadi.com/gynecology/cervical-conditions/stenosis/
N88.3,Incompetence of cervix uteri,https://www.webmd.com/women/what-is-incompetent-cervix
N88.4,Hypertrophic elongation of cervix uteri,https://pubmed.ncbi.nlm.nih.gov/20333504/
N88.8,Other specified noninflammatory disorders of cervix uteri,https://icd.who.int/browse10/2015/en#N85.7
N88.9,"Noninflammatory disorder of cervix uteri, unspecified",https://medlineplus.gov/cervixdisorders.html
N89,Other noninflammatory disorders of vagina,https://www.ncbi.nlm.nih.gov/medgen/510269
N89.0,Mild vaginal dysplasia,https://www.webmd.com/cancer/cervical-cancer/cervical-dysplasia-symptoms-causes-treatments
N89.1,Moderate vaginal dysplasia,https://www.webmd.com/cancer/cervical-cancer/cervical-dysplasia-symptoms-causes-treatments
N89.2,"Severe vaginal dysplasia, not elsewhere classified",https://www.medicinenet.com/cervical_dysplasia/article.htm
N89.3,"Dysplasia of vagina, unspecified",https://www.cancer.columbia.edu/cancer-types-care/types/vaginal-cancer/vaginal-dysplasia
N89.4,Leukoplakia of vagina,https://www.ncbi.nlm.nih.gov/pmc/articles/PMC7573333/
N89.5,Stricture and atresia of vagina,https://en.wikipedia.org/wiki/Vaginal_atresia
N89.6,Tight hymenal ring,https://www.healthline.com/health/womens-health/imperforate-hymen
N89.7,Haematocolpos,https://es.wikipedia.org/wiki/Hematocolpos
N89.8,Other specified noninflammatory disorders of vagina,https://www.icd10data.com/ICD10CM/Codes/N00-N99/N80-N98/N89-/N89.8
N89.9,"Noninflammatory disorder of vagina, unspecified",https://www.tabletwise.net/health/noninflammatory-disorder-of-vagina
N90,Other noninflammatory disorders of vulva and perineum,https://medlineplus.gov/vulvardisorders.html
N90.0,Mild vulvar dysplasia,https://www.cancer.columbia.edu/cancer-types-care/types/vulvar-cancer/vulvar-dysplasia
N90.1,Moderate vulvar dysplasia,https://www.cancer.columbia.edu/cancer-types-care/types/vulvar-cancer/vulvar-dysplasia
N90.2,"Severe vulvar dysplasia, not elsewhere classified",https://www.cancer.columbia.edu/cancer-types-care/types/vulvar-cancer/vulvar-dysplasia
N90.3,"Dysplasia of vulva, unspecified",https://www.cancer.columbia.edu/cancer-types-care/types/vulvar-cancer/vulvar-dysplasia
N90.4,Leukoplakia of vulva,https://www.ncbi.nlm.nih.gov/pmc/articles/PMC7573333/
N90.5,Atrophy of vulva,https://my.clevelandclinic.org/health/diseases/15500-vaginal-atrophy
N90.6,Hypertrophy of vulva,https://www.healthline.com/health/womens-health/labial-hypertrophy
N90.7,Vulvar cyst,https://my.clevelandclinic.org/health/diseases/17737-bartholin-cyst
N90.8,Other specified noninflammatory disorders of vulva and perineum,https://www.icd10data.com/ICD10CM/Codes/N00-N99/N80-N98/N90-/N90.89
N90.9,"Noninflammatory disorder of vulva and perineum, unspecified",https://www.icd10data.com/ICD10CM/Codes/N00-N99/N80-N98/N90-/N90.9
N91,"Absent, scanty and rare menstruation",https://www.mfine.co/gynecologists/conditions/absent-scanty-or-rare-menstruation/
N91.0,Primary amenorrhoea,https://familydoctor.org/condition/amenorrhea/
N91.1,Secondary amenorrhoea,https://www.healthline.com/health/secondary-amenorrhea
N91.2,"Amenorrhoea, unspecified",https://www.mayoclinic.org/diseases-conditions/amenorrhea/symptoms-causes/syc-20369299
N91.3,Primary oligomenorrhoea,http://www.healthofchildren.com/N-O/Oligomenorrhea.html
N91.4,Secondary oligomenorrhoea,http://www.healthofchildren.com/N-O/Oligomenorrhea.html
N91.5,"Oligomenorrhoea, unspecified",https://www.verywellhealth.com/an-overview-of-oligomenorrhea-4584379
N92,"Excessive, frequent and irregular menstruation",https://www.healthline.com/health/menstrual-periods-heavy-prolonged-or-irregular
N92.0,Excessive and frequent menstruation with regular cycle,https://www.healthline.com/health/menstrual-periods-heavy-prolonged-or-irregular
N92.1,Excessive and frequent menstruation with irregular cycle,https://my.clevelandclinic.org/health/diseases/14633-abnormal-menstruation-periods
N92.2,Excessive menstruation at puberty,https://en.wikipedia.org/wiki/Puberty_menorrhagia
N92.3,Ovulation bleeding,https://www.healthline.com/health/pregnancy/ovulation-bleeding
N92.4,Excessive bleeding in the premenopausal period,https://www.healthline.com/health/menopause/perimenopause-periods
N92.5,Other specified irregular menstruation,https://my.clevelandclinic.org/health/diseases/14633-abnormal-menstruation-periods
N92.6,"Irregular menstruation, unspecified",https://www.medicalnewstoday.com/articles/178635
N93,Other abnormal uterine and vaginal bleeding,https://www.dignityhealth.org/conditions-and-treatments/womens-services/gynecology/abnormal-uterine-bleeding
N93.0,Postcoital and contact bleeding,https://www.nhs.uk/common-health-questions/womens-health/what-causes-a-woman-to-bleed-after-sex/
