codigo,descripcion,url
V88.3,"Person injured in collision between car and bus, nontraffic",https://icd.who.int/browse10/2008/en#/V74.3
V88.4,"Person injured in collision between car and heavy transport vehicle, nontraffic",https://icd.who.int/browse10/2019/en#/V89.2
V88.5,"Person injured in collision between heavy transport vehicle and bus, nontraffic",https://icd.who.int/browse10/2019/en#/V89.2
V88.6,"Person injured in collision between railway train or railway vehicle and car, nontraffic",https://icd.who.int/browse10/2019/en#/V89.2
V88.7,"Person injured in collision between other specified motor vehicles, nontraffic",https://icd.who.int/browse10/2019/en#/V89.2
V88.8,"Person injured in other specified noncollision transport accidents involving motor vehicle, nontraffic",https://icd.who.int/browse10/2019/en#/V89.2
V88.9,"Person injured in other specified (collision)(noncollision) transport accidents involving nonmotor vehicle, nontraffic",https://icd.who.int/browse10/2019/en#/V89.2
V89,"Motor- or nonmotor-vehicle accident, type of vehicle unspecified",https://www.icd10data.com/ICD10CM/Codes/V00-Y99/V80-V89/V89-
V89.0,"Person injured in unspecified motor-vehicle accident, nontraffic",https://icd.who.int/browse10/2019/en#/V89.2
V89.1,"Person injured in unspecified nonmotor-vehicle accident, nontraffic",https://icd.who.int/browse10/2019/en#/V89.2
V89.2,"Person injured in unspecified motor-vehicle accident, traffic",https://www.icd10data.com/ICD10CM/Codes/V00-Y99/V80-V89/V89-/V89.2XXA
V89.3,"Person injured in unspecified nonmotor-vehicle accident, traffic",https://www.icd10data.com/ICD10CM/Codes/V00-Y99/V80-V89/V89-/V89.2XXA
V89.9,Person injured in unspecified vehicle accident,https://www.garymartinhays.com/car-accident-posts/car-accident-injury-symptoms/
V90,Accident to watercraft causing drowning and submersion,https://icd.who.int/browse10/2019/en#/V90.8
V90.0,Accident to watercraft causing drowning and submersion : merchant ship,https://icd.who.int/browse10/2019/en#/V90.8
V90.1,Accident to watercraft causing drowning and submersion : passenger ship,https://icd.who.int/browse10/2010/en#/V90.6
V90.2,Accident to watercraft causing drowning and submersion : fishing boat,http://www.szpilman.com/new_szpilman/szpilman/ARTIGOS/105_Classifications%20of%20Drowning.pdf
V90.3,Accident to watercraft causing drowning and submersion : other powered watercraft,https://icd.who.int/browse10/2019/en#/V90.8
V90.4,Accident to watercraft causing drowning and submersion : sailboat,https://icd.who.int/browse10/2010/en#/V90.6
V90.5,Accident to watercraft causing drowning and submersion : canoe or kayak,https://icd.who.int/browse10/2019/en#/V90.8
V90.6,Accident to watercraft causing drowning and submersion : inflatable craft (nonpowered),https://icd.who.int/browse10/2019/en#/V90.8
V90.7,Accident to watercraft causing drowning and submersion : water-skis,http://apps.who.int/classifications/icd10/browse/2014/en#/V93.3
V90.8,Accident to watercraft causing drowning and submersion : other unpowered watercraft,https://icd.who.int/browse10/2019/en#/V90.8
V90.9,Accident to watercraft causing drowning and submersion : unspecified watercraft,https://icd.who.int/browse10/2019/en#/V90.8
V91,Accident to watercraft causing other injury,https://www.icd10data.com/ICD10CM/Codes/V00-Y99/V90-V94/V91-/V91.89XA
V91.0,Accident to watercraft causing other injury : merchant ship,https://icd.who.int/browse10/2019/en#/V90.8
V91.1,Accident to watercraft causing other injury : passenger ship,https://icd.who.int/browse10/2019/en#/V90.8
V91.2,Accident to watercraft causing other injury : fishing boat,https://www.icd10data.com/ICD10CM/Codes/V00-Y99/V90-V94/V91-
V91.3,Accident to watercraft causing other injury : other powered watercraft,https://icd.who.int/browse10/2019/en#/V90.8
V91.4,Accident to watercraft causing other injury : sailboat,https://www.icd10data.com/ICD10CM/Codes/V00-Y99/V90-V94/V91-
V91.5,Accident to watercraft causing other injury : canoe or kayak,https://www.icd10data.com/ICD10CM/Codes/V00-Y99/V90-V94/V91-
V91.6,Accident to watercraft causing other injury : inflatable craft (nonpowered),https://icd.who.int/browse10/2019/en#/V90.8
V91.7,Accident to watercraft causing other injury : water-skis,https://www.icd10data.com/ICD10CM/Codes/V00-Y99/V90-V94/V93-/V93.87
V91.8,Accident to watercraft causing other injury : other unpowered watercraft,https://www.icd10data.com/ICD10CM/Codes/V00-Y99/V90-V94/V91-
V91.9,Accident to watercraft causing other injury : unspecified watercraft,https://www.icd10data.com/ICD10CM/Codes/V00-Y99/V90-V94/V91-/V91.89XA
V92,Water-transport-related drowning and submersion without accident to watercraft,https://icd.who.int/browse10/2019/en#/V90.8
V92.0,Water-transport-related drowning and submersion without accident to watercraft : merchant ship,https://icd.who.int/browse10/2019/en#/V90.8
V92.1,Water-transport-related drowning and submersion without accident to watercraft : passenger ship,https://icd.who.int/browse10/2019/en#/V90.8
V92.2,Water-transport-related drowning and submersion without accident to watercraft : fishing boat,https://icd.who.int/browse10/2019/en#/V90.8
V92.3,Water-transport-related drowning and submersion without accident to watercraft : other powered watercraft,https://icd.who.int/browse10/2019/en#/V90.8
V92.4,Water-transport-related drowning and submersion without accident to watercraft : sailboat,https://icd.who.int/browse10/2019/en#/V90.8
V92.5,Water-transport-related drowning and submersion without accident to watercraft : canoe or kayak,https://icd.who.int/browse10/2019/en#/V90.8
V92.6,Water-transport-related drowning and submersion without accident to watercraft : inflatable craft (nonpowered),https://icd.who.int/browse10/2019/en#/V90.8
V92.7,Water-transport-related drowning and submersion without accident to watercraft : water-skis,https://icd.who.int/browse10/2019/en#/V90.8
V92.8,Water-transport-related drowning and submersion without accident to watercraft : other unpowered watercraft,https://icd.who.int/browse10/2019/en#/V90.8
V92.9,Water-transport-related drowning and submersion without accident to watercraft : unspecified watercraft,https://icd.who.int/browse10/2019/en#/V90.8
V93,"Accident on board watercraft without accident to watercraft, not causing drowning and submersion",https://icd.who.int/browse10/2019/en#/V90.8
V93.0,"Accident on board watercraft without accident to watercraft, not causing drowning and submersion : merchant ship",https://icd.who.int/browse10/2019/en#/V90.8
V93.1,"Accident on board watercraft without accident to watercraft, not causing drowning and submersion : passenger ship",https://icd.who.int/browse10/2019/en#/V90.8
V93.2,"Accident on board watercraft without accident to watercraft, not causing drowning and submersion : fishing boat",https://icd.who.int/browse10/2019/en#/V90.8
V93.3,"Accident on board watercraft without accident to watercraft, not causing drowning and submersion : other powered watercraft",https://icd.who.int/browse10/2019/en#/V90.8
V93.4,"Accident on board watercraft without accident to watercraft, not causing drowning and submersion : sailboat",https://icd.who.int/browse10/2019/en#/V90.8
V93.5,"Accident on board watercraft without accident to watercraft, not causing drowning and submersion : canoe or kayak",https://icd.who.int/browse10/2019/en#/V90.8
V93.6,"Accident on board watercraft without accident to watercraft, not causing drowning and submersion : inflatable craft (nonpowered)",https://icd.who.int/browse10/2019/en#/V90.8
V93.7,"Accident on board watercraft without accident to watercraft, not causing drowning and submersion : water-skis",https://icd.who.int/browse10/2019/en#/V90.8
V93.8,"Accident on board watercraft without accident to watercraft, not causing drowning and submersion : other unpowered watercraft",https://icd.who.int/browse10/2019/en#/V90.8
V93.9,"Accident on board watercraft without accident to watercraft, not causing drowning and submersion : unspecified watercraft",https://icd.who.int/browse10/2019/en#/V90.8
V94,Other and unspecified water transport accidents,https://icd.who.int/browse10/2019/en#/V90.8
V94.0,Other and unspecified water transport accidents : merchant ship,https://icd.who.int/browse10/2019/en#/V90.8
V94.1,Other and unspecified water transport accidents : passenger ship,https://icd.who.int/browse10/2019/en#/V90.8
V94.2,Other and unspecified water transport accidents : fishing boat,https://icd.who.int/browse10/2019/en#/V90.8
V94.3,Other and unspecified water transport accidents : other powered watercraft,https://icd.who.int/browse10/2019/en#/V90.8
V94.4,Other and unspecified water transport accidents : sailboat,https://icd.who.int/browse10/2019/en#/V90.8
V94.5,Other and unspecified water transport accidents : canoe or kayak,https://icd.who.int/browse10/2019/en#/V90.8
V94.6,Other and unspecified water transport accidents : inflatable craft (nonpowered),http://apps.who.int/classifications/icd10/browse/2010/en#!V92.5
V94.7,Other and unspecified water transport accidents : water-skis,http://apps.who.int/classifications/icd10/browse/2010/en#!V92.5
V94.8,Other and unspecified water transport accidents : other unpowered watercraft,https://icd.who.int/browse10/2019/en#/V90.8
V94.9,Other and unspecified water transport accidents : unspecified watercraft,https://icd.who.int/browse10/2008/en#/V93.7
V95,Accident to powered aircraft causing injury to occupant,https://www.sto.nato.int/publications/STO%20Educational%20Notes/RTO-EN-HFM-113/EN-HFM-113-03.pdf
V95.0,Helicopter accident injuring occupant,https://pubmed.ncbi.nlm.nih.gov/26735230/
V95.1,"Ultralight, microlight or powered-glider accident injuring occupant",https://icdreference.com/icd-codes/forced-landing-of-ultralight-microlight-or-powered-glider-injuring-occupant-initial-encounter-32xgr58
V95.2,"Accident to other private fixed-wing aircraft, injuring occupant",https://www.faa.gov/documentlibrary/media/order/faa_order_8020.11d.pdf
V95.3,"Accident to commercial fixed-wing aircraft, injuring occupant",https://www.ncbi.nlm.nih.gov/pmc/articles/PMC2810202/
V95.4,Spacecraft accident injuring occupant,https://www.icd10data.com/ICD10CM/Codes/V00-Y99/V95-V97/V95-/V95.43XA
V95.8,Other aircraft accidents injuring occupant,https://www.sto.nato.int/publications/STO%20Educational%20Notes/RTO-EN-HFM-113/EN-HFM-113-03.pdf
V95.9,Unspecified aircraft accident injuring occupant,https://www.icd10data.com/ICD10CM/Codes/V00-Y99/V95-V97/V95-/V95.9
V96,Accident to nonpowered aircraft causing injury to occupant,https://www.faa.gov/air_traffic/publications/atpubs/aim_html/chap7_section_6.html
V96.0,Balloon accident injuring occupant,https://www.icd10data.com/ICD10CM/Codes/V00-Y99/V95-V97/V96-/V96.0
V96.1,Hang-glider accident injuring occupant,https://www.icd10data.com/ICD10CM/Codes/V00-Y99/V95-V97/V96-/V96.1
V96.2,Glider (nonpowered) accident injuring occupant,http://apps.who.int/classifications/icd10/browse/2014/en#/V97.2
V96.8,Other nonpowered-aircraft accidents injuring occupant,http://apps.who.int/classifications/icd10/browse/2015/en#/V95.9
V96.9,Unspecified nonpowered-aircraft accident injuring occupant,http://apps.who.int/classifications/icd10/browse/2015/en#/V95.9
V97,Other specified air transport accidents,https://www.thewebsterlawfirm.com/blog/2019/april/aviation-accidents-cause-and-effect/
V97.0,Occupant of aircraft injured in other specified air transport accidents,http://apps.who.int/classifications/icd10/browse/2015/en#/V95.9
V97.1,Person injured while boarding or alighting from aircraft,http://apps.who.int/classifications/icd10/browse/2014/en#/V97.2
V97.2,Parachutist injured in air transport accident,https://phc.amedd.army.mil/PHC%20Resource%20Library/ParachutingInjuries_FS_12-006-1115.pdf
V97.3,Person on ground injured in air transport accident,https://www.sto.nato.int/publications/STO%20Educational%20Notes/RTO-EN-HFM-113/EN-HFM-113-03.pdf
V97.8,"Other air transport accidents, not elsewhere classified",https://icd.who.int/browse10/2010/en#V97.1
V98,Other specified transport accidents,https://icd.who.int/browse10/2019/en#/V80-V89
V99,Unspecified transport accident,https://icd.who.int/browse10/2016/en#/V01-V99
W00,Fall on same level involving ice and snow,https://www.icd10data.com/ICD10CM/Codes/V00-Y99/W00-W19/W00-
W01,"Fall on same level from slipping, tripping and stumbling",https://www.icd10data.com/ICD10CM/Codes/V00-Y99/W00-W19/W01-/W01.0
W02,"Fall involving ice-skates, skis, roller-skates or skateboards",https://icd.who.int/browse10/2016/en#/W00
W03,"Other fall on same level due to collision with, or pushing by, another person",https://icdlist.com/icd-10/W03.XXXA
W04,Fall while being carried or supported by other persons,https://www.mayoclinic.org/diseases-conditions/factitious-disorder/symptoms-causes/syc-20356028
W05,Fall involving wheelchair,https://pubmed.ncbi.nlm.nih.gov/31545572/
W06,Fall involving bed,https://www.seniorsmatter.com/causes-risks-and-solutions-for-seniors-falling-out-of-bed/2491886/
W07,Fall involving chair,https://www.kmwlegal.com/chair-fall-accident
W08,Fall involving other furniture,https://www.nytimes.com/2009/05/05/health/05haza.html
W09,Fall involving playground equipment,https://contelawyers.ca/types-of-playground-equipment-most-likely-to-cause-injury/
W10,Fall on and from stairs and steps,https://blog.lapeyrestair.com/falling-down-stairs
W11,Fall on and from ladder,https://www.visitcompletecare.com/blog/falling-off-a-ladder/
W12,Fall on and from scaffolding,https://www.cpwr.com/wp-content/uploads/publications/Scaffolds-Fact-Sheet.pdf
W13,"Fall from, out of or through building or structure",https://www.argionislaw.com/slip-and-falls/common-slip-and-fall-injury-symptoms/
W14,Fall from tree,https://www.webmd.com/allergies/fall-allergy-relief
W15,Fall from cliff,https://www.mayoclinic.org/diseases-conditions/c-difficile/symptoms-causes/syc-20351691
W16,Diving or jumping into water causing injury other than drowning or submersion,https://www.who.int/water_sanitation_health/bathing/bathwatchap7.pdf
W17,Other fall from one level to another,https://www.icd10data.com/ICD10CM/Codes/V00-Y99/W00-W19/W17-
W18,Other fall on same level,https://www.icd10data.com/ICD10CM/Codes/V00-Y99/W00-W19/W18-/W18.39XA
W19,Unspecified fall,https://www.icd10data.com/ICD10CM/Codes/V00-Y99/W00-W19/W19-
W20,"Struck by thrown, projected or falling object(s)",https://www.icd10data.com/ICD10CM/Codes/V00-Y99/W20-W49/W20-
W21,Striking against or struck by sports equipment,https://www.icd10data.com/ICD10CM/Codes/V00-Y99/W20-W49/W21-
W22,Striking against or struck by other object(s),https://www.icd10data.com/ICD10CM/Codes/V00-Y99/W20-W49/W22-/W22.8XXA
W23,"Caught, crushed, jammed or pinched in or between objects",https://www.icd10data.com/ICD10CM/Codes/V00-Y99/W20-W49/W23-
W24,"Contact with lifting and transmission device(s), not elsewhere classified",https://icdcode.info/icd-10/code-w24.html
W25,Contact with sharp glass,https://icdlist.com/icd-10/W25.XXXA
W26,Contact with other sharp object(s),https://symptomd.com/icd10/w26-contact-with-other-sharp-object-s
W26.0,"Contact with knife, sword or dagger",https://icdcode.info/icd-10/code-w26.html
W26.8,"Contact with other sharp object(s), not elsewhere classified",https://icdlist.com/icd-10/W26.8XXA
W26.9,Contact with unspecified sharp object(s),https://www.icd10data.com/ICD10CM/Codes/V00-Y99/W20-W49/W26-/W26.9
W27,Contact with nonpowered hand tool,https://www.safetyandhealthmagazine.com/articles/non-powered-hand-tools-2
W28,Contact with powered lawnmower,https://www.icd10data.com/ICD10CM/Codes/V00-Y99/W20-W49/W28-/W28
W29,Contact with other powered hand tools and household machinery,https://www.icd10data.com/ICD10CM/Codes/V00-Y99/W20-W49/W29-/W29.8XXA
W30,Contact with agricultural machinery,https://www.sciencedirect.com/science/article/pii/S0169814107001801
W31,Contact with other and unspecified machinery,https://www.icd10data.com/ICD10CM/Codes/V00-Y99/W20-W49/W31-/W31.9XXA
W32,Handgun discharge,https://www.guncrafttraining.com/articles/negligent-discharge-vs-accidental-discharge
W33,"Rifle, shotgun and larger firearm discharge",https://www.icd10data.com/ICD10CM/Codes/V00-Y99/W20-W49/W33-
W34,Discharge from other and unspecified firearms,https://www.cdc.gov/nchs/injury/ice/amsterdam1998/amsterdam1998_guncodes.htm
W35,Explosion and rupture of boiler,https://en.wikipedia.org/wiki/Boiler_explosion
W36,Explosion and rupture of gas cylinder,https://www.elgas.co.nz/resources/elgas-blog/256-how-why-would-an-lpg-cylinder-explode-lpg-cylinder-blast-propane/
W37,"Explosion and rupture of pressurized tyre, pipe or hose",https://www.icd10data.com/ICD10CM/Codes/V00-Y99/W20-W49/W37-/W37.8
W38,Explosion and rupture of other specified pressurized devices,https://www.icd10data.com/ICD10CM/Codes/V00-Y99/W20-W49/W38-/W38.XXXA
W39,Discharge of firework,https://www.webmd.com/eye-health/news/20120703/how-fireworks-may-actually-hurt-eyes
W40,Explosion of other materials,https://www.gov.uk/government/publications/health-effects-of-explosions-and-fires/health-effects-of-explosions
W41,Exposure to high-pressure jet,https://www.safeworkaustralia.gov.au/system/files/documents/1702/guide-managing-high-pressure-water-jetting.pdf
W42,Exposure to noise,https://www.cdc.gov/vitalsigns/hearingloss/index.html
W43,Exposure to vibration,https://www.cdc.gov/niosh/docs/83-110/default.html
W44,Foreign body entering into or through eye or natural orifice,https://icd.who.int/browse10/2016/en#/T15.1
W45,Foreign body or object entering through skin,https://www.emedicinehealth.com/what_happens_to_foreign_objects_under_the_skin/article_em.htm
W46,Contact with hypodermic needle,https://www.nhs.uk/common-health-questions/accidents-first-aid-and-treatments/what-should-i-do-if-i-injure-myself-with-a-used-needle/
W49,Exposure to other and unspecified inanimate mechanical forces,https://icd.who.int/browse10/2019/en#/W20-W49
W50,"Hit, struck, kicked, twisted, bitten or scratched by another person",https://icdlist.com/icd-10/W50.0XXA
W51,Striking against or bumped into by another person,https://www.icd10data.com/ICD10CM/Codes/V00-Y99/W50-W64/W51-/W51
W52,"Crushed, pushed or stepped on by crowd or human stampede",https://en.wikipedia.org/wiki/Stampede
W53,Bitten by rat,https://www.webmd.com/first-aid/what-to-know-rat-bite-fever
W54,Bitten or struck by dog,https://www.sciencedirect.com/science/article/pii/S0379073820304540
W55,Bitten or struck by other mammals,https://icd.who.int/browse10/2016/en#/W52
W56,Contact with marine animal,https://www.mountsinai.org/health-library/injury/marine-animal-stings-or-bites
W57,Bitten or stung by nonvenomous insect and other nonvenomous arthropods,https://www.nidirect.gov.uk/conditions/insect-bites-and-stings
W58,Bitten or struck by crocodile or alligator,https://www.msdmanuals.com/home/injuries-and-poisoning/bites-and-stings/alligator-crocodile-and-iguana-bites
W59,Bitten or crushed by other reptiles,https://www.ncbi.nlm.nih.gov/pmc/articles/PMC3407400/
W60,Contact with plant thorns and spines and sharp leaves,https://www.icd10data.com/ICD10CM/Codes/V00-Y99/W50-W64/W60-/W60
W64,Exposure to other and unspecified animate mechanical forces,https://www.icd10data.com/ICD10CM/Codes/V00-Y99/W50-W64
W65,Drowning and submersion while in bath-tub,https://www.healthline.com/health/dry-drowning
W66,Drowning and submersion following fall into bath-tub,https://www.medicinenet.com/drowning/article.htm
W67,Drowning and submersion while in swimming-pool,https://www.healthline.com/health/dry-drowning
W68,Drowning and submersion following fall into swimming-pool,https://www.healthline.com/health/dry-drowning
W69,Drowning and submersion while in natural water,https://www.emedicinehealth.com/drowning/article_em.htm
W70,Drowning and submersion following fall into natural water,https://www.emedicinehealth.com/drowning/article_em.htm
W73,Other specified drowning and submersion,https://www.medicinenet.com/drowning/article.htm
W74,Unspecified drowning and submersion,https://en.wikipedia.org/wiki/Drowning
W75,Accidental suffocation and strangulation in bed,https://www.dhhs.nh.gov/dphs/bchs/mch/documents/suffocation-strangulation-infant-sleep-infographic.pdf
W76,Other accidental hanging and strangulation,https://www.ncbi.nlm.nih.gov/books/NBK459192/
W77,"Threat to breathing due to cave-in, falling earth and other substances",https://icd.who.int/browse10/2010/en#/W75-W84
W78,Inhalation of gastric contents,https://ada.com/conditions/acute-aspiration-of-e-or-gastric-contents/
W79,Inhalation and ingestion of food causing obstruction of respiratory tract,https://ada.com/conditions/foreign-body-aspiration/
W80,Inhalation and ingestion of other objects causing obstruction of respiratory tract,https://ada.com/conditions/foreign-body-aspiration/
W81,Confined to or trapped in a low-oxygen environment,https://www.ccohs.ca/oshanswers/hsprograms/confinedspace_intro.html
W83,Other specified threats to breathing,https://www.healthline.com/health/breathing-difficulties
W84,Unspecified threat to breathing,https://www.icd10data.com/ICD10CM/Codes/S00-T88/T66-T78/T71-/T71.193
W85,Exposure to electric transmission lines,https://www.cancer.org/cancer/cancer-causes/radiation-exposure/extremely-low-frequency-radiation.html
W86,Exposure to other specified electric current,https://icd.who.int/browse10/2019/en#/W86
W87,Exposure to unspecified electric current,https://icd.who.int/browse10/2019/en#/W86
W88,Exposure to ionizing radiation,https://www.mayoclinic.org/diseases-conditions/radiation-sickness/symptoms-causes/syc-20377058
W89,Exposure to man-made visible and ultraviolet light,https://www.cancer.org/cancer/cancer-causes/radiation-exposure/uv-radiation.html
W90,Exposure to other nonionizing radiation,https://www.cdc.gov/nceh/radiation/nonionizing_radiation.html
W91,Exposure to unspecified type of radiation,https://medlineplus.gov/ency/article/000026.htm
W92,Exposure to excessive heat of man-made origin,https://www.ccohs.ca/oshanswers/phys_agents/heat_health.html
W93,Exposure to excessive cold of man-made origin,https://www.cdc.gov/niosh/topics/coldstress/coldrelatedillnesses.html
W94,Exposure to high and low air pressure and changes in air pressure,https://derangedphysiology.com/cicm-primary-exam/required-reading/respiratory-system/Chapter%20923/physiological-effects-high-and-low-barometric-pressure
W99,Exposure to other and unspecified man-made environmental factors,https://icd.who.int/browse10/2019/en#/W85-W99
X00,Exposure to uncontrolled fire in building or structure,https://www.icd10data.com/ICD10CM/Codes/V00-Y99/X00-X08/X00-/X00.0XXA
X01,"Exposure to uncontrolled fire, not in building or structure",https://www.icd10data.com/ICD10CM/Codes/V00-Y99/X00-X08/X01-/X01
X02,Exposure to controlled fire in building or structure,https://www.icd10data.com/ICD10CM/Codes/V00-Y99/X00-X08/X03-
X03,"Exposure to controlled fire, not in building or structure",https://www.icd10data.com/ICD10CM/Codes/V00-Y99/X00-X08/X03-
X04,Exposure to ignition of highly flammable material,https://www.icd10data.com/ICD10CM/Codes/V00-Y99/X00-X08/X04-/X04
X05,Exposure to ignition or melting of nightwear,https://symptomd.com/icd10/x05-exposure-to-ignition-or-melting-of-nightwear
X06,Exposure to ignition or melting of other clothing and apparel,https://www.icd10data.com/ICD10CM/Codes/V00-Y99/X00-X08/X06-/X06
X08,"Exposure to other specified smoke, fire and flames",https://www.icd10data.com/ICD10CM/Codes/V00-Y99/X00-X08/X08-/X08.8XXA
X09,"Exposure to unspecified smoke, fire and flames",https://icd.who.int/browse10/2019/en#/X00
X10,"Contact with hot drinks, food, fats and cooking oils",https://www.icd10data.com/ICD10CM/Codes/V00-Y99/X10-X19/X10-/X10.2
X11,Contact with hot tap-water,https://www.medicalnewstoday.com/articles/326405
X12,Contact with other hot fluids,https://www.icd10data.com/ICD10CM/Codes/V00-Y99/X10-X19/X12-/X12
X13,Contact with steam and hot vapours,https://www.verywellhealth.com/steam-burns-overview-4507433
X14,Contact with hot air and gases,https://www.hopkinsmedicine.org/health/conditions-and-diseases/carbon-monoxide-poisoning
X15,Contact with hot household appliances,https://www.icd10data.com/ICD10CM/Codes/V00-Y99/X10-X19/X15-
X16,"Contact with hot heating appliances, radiators and pipes",https://www.icd10data.com/ICD10CM/Codes/V00-Y99/X10-X19/X16-/X16
X17,"Contact with hot engines, machinery and tools",https://www.aapc.com/codes/icd-10-codes/X17.XXXA
X18,Contact with other hot metals,https://en.wikipedia.org/wiki/Metal_fume_fever
X19,Contact with other and unspecified heat and hot substances,https://www.icd10data.com/ICD10CM/Codes/V00-Y99/X10-X19/X19-/X19.XXXA
X20,Contact with venomous snakes and lizards,https://www.uofmhealth.org/health-library/snake
X21,Contact with venomous spiders,https://www.cdc.gov/niosh/topics/spiders/symptoms.html
X22,Contact with scorpions,https://www.mayoclinic.org/diseases-conditions/scorpion-stings/symptoms-causes/syc-20353859
X23,"Contact with hornets, wasps and bees",https://www.healthline.com/health/wasp-sting
X24,Contact with centipedes and venomous millipedes (tropical),https://www.mountsinai.org/health-library/poison/millipede-toxin
X25,Contact with other venomous arthropods,https://www.scielo.br/j/rsbmt/a/mvnXNQhMXMyYsYWcLFPXgzP/?lang=en
X26,Contact with venomous marine animals and plants,https://www.healthline.com/health/marine-animal-stings-or-bites
X27,Contact with other specified venomous animals,https://icd.who.int/browse10/2019/en#/X20
X28,Contact with other specified venomous plants,https://www.cdc.gov/niosh/topics/plants/symptoms.html
X29,Contact with unspecified venomous animal or plant,https://icd.who.int/browse10/2016/en#/X20-X29
X30,Exposure to excessive natural heat,https://www.ccohs.ca/oshanswers/phys_agents/heat_health.html
X31,Exposure to excessive natural cold,https://www.mayoclinic.org/diseases-conditions/common-cold/symptoms-causes/syc-20351605
X32,Exposure to sunlight,https://www.webmd.com/skin-problems-and-treatments/sun-poisoning
